{
  "schema_version": "1.0",
  "kind": "isolation-review",
  "id": "ISO-PLAN-001-r3-independent",
  "plan_id": "PLAN-001",
  "graph_revision": 3,
  "task_set_sha256": "79f1137d5bfc5cb0a5148b4d0f3d67487d5a7ff43ab218ea00e04c3bad315883",
  "verdict": "fail",
  "reviewer": "/root/isolation_review; coordinator-configured gpt-6-astra/xhigh fresh invocation; no provider-returned model identifier exposed",
  "review_kind": "foundation_design_review",
  "checks": [
    {
      "id": "ISO-01",
      "status": "pass",
      "rationale": "39 coherent bounded component tasks; each has two acceptance checks.",
      "evidence": [
        ".ai/plans/current/PLAN-001/reviews/r3-isolation-review.md",
        ".ai/plans/current/PLAN-001/reviews/r3-isolation-reproduction.txt"
      ]
    },
    {
      "id": "ISO-02",
      "status": "fail",
      "rationale": "TASK-004 digest migration compatibility needs an explicit output contract.",
      "evidence": [
        ".ai/plans/current/PLAN-001/reviews/r3-isolation-review.md",
        ".ai/plans/current/PLAN-001/reviews/r3-isolation-reproduction.txt"
      ]
    },
    {
      "id": "ISO-03",
      "status": "pass",
      "rationale": "Explicit source/test/evidence ownership; final docs payload owned by TASK-037.",
      "evidence": [
        ".ai/plans/current/PLAN-001/reviews/r3-isolation-review.md",
        ".ai/plans/current/PLAN-001/reviews/r3-isolation-reproduction.txt"
      ]
    },
    {
      "id": "ISO-04",
      "status": "pass",
      "rationale": "280 unordered pairs have no declared normalized path or resource overlap.",
      "evidence": [
        ".ai/plans/current/PLAN-001/reviews/r3-isolation-review.md",
        ".ai/plans/current/PLAN-001/reviews/r3-isolation-reproduction.txt"
      ]
    },
    {
      "id": "ISO-05",
      "status": "fail",
      "rationale": "Frozen port owners are named, but the installed helper dependency closure lacks an early owner.",
      "evidence": [
        ".ai/plans/current/PLAN-001/reviews/r3-isolation-review.md",
        ".ai/plans/current/PLAN-001/reviews/r3-isolation-reproduction.txt"
      ]
    },
    {
      "id": "ISO-06",
      "status": "pass",
      "rationale": "Existing shared schemas are frozen; logical references can use current string fields.",
      "evidence": [
        ".ai/plans/current/PLAN-001/reviews/r3-isolation-review.md",
        ".ai/plans/current/PLAN-001/reviews/r3-isolation-reproduction.txt"
      ]
    },
    {
      "id": "ISO-07",
      "status": "fail",
      "rationale": "New validator/CLI imports precede installed helper catalog updates.",
      "evidence": [
        ".ai/plans/current/PLAN-001/reviews/r3-isolation-review.md",
        ".ai/plans/current/PLAN-001/reviews/r3-isolation-reproduction.txt"
      ]
    },
    {
      "id": "ISO-08",
      "status": "pass",
      "rationale": "All 39 nodes and dependencies agree and are acyclic.",
      "evidence": [
        ".ai/plans/current/PLAN-001/reviews/r3-isolation-review.md",
        ".ai/plans/current/PLAN-001/reviews/r3-isolation-reproduction.txt"
      ]
    },
    {
      "id": "ISO-09",
      "status": "fail",
      "rationale": "TASK-004 cannot preserve installed validator behavior within current writes without a specified migration.",
      "evidence": [
        ".ai/plans/current/PLAN-001/reviews/r3-isolation-review.md",
        ".ai/plans/current/PLAN-001/reviews/r3-isolation-reproduction.txt"
      ]
    },
    {
      "id": "ISO-10",
      "status": "pass",
      "rationale": "Current component boundaries are independently reviewable.",
      "evidence": [
        ".ai/plans/current/PLAN-001/reviews/r3-isolation-review.md",
        ".ai/plans/current/PLAN-001/reviews/r3-isolation-reproduction.txt"
      ]
    },
    {
      "id": "ISO-11",
      "status": "fail",
      "rationale": "Runtime helper dependency closure and digest compatibility need early ownership.",
      "evidence": [
        ".ai/plans/current/PLAN-001/reviews/r3-isolation-review.md",
        ".ai/plans/current/PLAN-001/reviews/r3-isolation-reproduction.txt"
      ]
    },
    {
      "id": "ISO-12",
      "status": "pass",
      "rationale": "All nine plan acceptance criteria have implementation and integrated verification coverage.",
      "evidence": [
        ".ai/plans/current/PLAN-001/reviews/r3-isolation-review.md",
        ".ai/plans/current/PLAN-001/reviews/r3-isolation-reproduction.txt"
      ]
    }
  ],
  "findings": [
    {
      "id": "R3-ISO-001",
      "severity": "blocking",
      "category": "structural",
      "description": "TASK-004 introduces validator helper dependencies before any owner may update the static standalone installed helper catalog; TASK-034 later repeats this risk for ai.py.",
      "paths": [
        "src/install.py",
        "src/validate_foundation.py",
        ".ai/plans/current/PLAN-001/tasks/current/TASK-004.json",
        ".ai/plans/current/PLAN-001/tasks/current/TASK-034.json"
      ],
      "expected_fix": "Grant TASK-004 narrowly scoped installer dependency-catalog ownership and acceptance proving complete installed helper closure from a clean target as flat-module imports grow; preserve all existing safe bootstrap behavior.",
      "acceptance_ids": [
        "AC-01",
        "AC-08",
        "AC-09"
      ],
      "resolved": false
    },
    {
      "id": "R3-ISO-002",
      "severity": "major",
      "category": "structural",
      "description": "The new lifecycle-neutral digest must define compatibility with reviewed current task identities while old ai.structural_task_digest consumers remain.",
      "paths": [
        ".ai/plans/current/PLAN-001/tasks/current/TASK-004.json",
        "src/ai.py"
      ],
      "expected_fix": "Require unchanged current identity reproduction, recognized lifecycle-location normalization, rejection of real structural changes, and retained compatibility entry point or explicit versioned migration with fresh approval.",
      "acceptance_ids": [
        "AC-01",
        "AC-03",
        "AC-07"
      ],
      "resolved": false
    }
  ],
  "rewrite_summary": [
    "Bound TASK-004 installer helper dependency catalog ownership and standalone installed regression acceptance.",
    "Clarify lifecycle digest compatibility and approval migration in TASK-004.",
    "Advance graph revision, recompute task digest, and obtain fresh independent review of the complete amended graph."
  ],
  "report_ref": ".ai/plans/current/PLAN-001/reviews/r3-isolation-review.md",
  "created_at": "2026-09-08T01:02:20.872909Z"
}
