{
  "schema_version": "1.0",
  "kind": "isolation-review",
  "id": "ISO-PLAN-001-r4-independent",
  "plan_id": "PLAN-001",
  "graph_revision": 4,
  "task_set_sha256": "c84fdf4e0affcb8d329e8fc7ce2ae928410b44a21238304b3348b2e7d1b75c9e",
  "verdict": "pass",
  "reviewer": "/root/isolation_review; coordinator-configured gpt-6-astra/xhigh invocation; no provider-returned model identifier exposed",
  "review_kind": "foundation_design_review",
  "checks": [
    {
      "id": "ISO-01",
      "status": "pass",
      "rationale": "Each task has 2-3 checks and a bounded component outcome; TASK-004 has explicit installer-catalog rationale.",
      "evidence": [
        ".ai/plans/current/PLAN-001/reviews/r4-isolation-review.md",
        ".ai/plans/current/PLAN-001/reviews/r4-isolation-reproduction.txt"
      ]
    },
    {
      "id": "ISO-02",
      "status": "pass",
      "rationale": "All inputs, outputs, scopes, commands and handoffs are explicit; digest compatibility is now testable.",
      "evidence": [
        ".ai/plans/current/PLAN-001/reviews/r4-isolation-review.md",
        ".ai/plans/current/PLAN-001/reviews/r4-isolation-reproduction.txt"
      ]
    },
    {
      "id": "ISO-03",
      "status": "pass",
      "rationale": "Exact flat source files and task-specific tests/evidence; TASK-037 owns the final reusable docs payload.",
      "evidence": [
        ".ai/plans/current/PLAN-001/reviews/r4-isolation-review.md",
        ".ai/plans/current/PLAN-001/reviews/r4-isolation-reproduction.txt"
      ]
    },
    {
      "id": "ISO-04",
      "status": "pass",
      "rationale": "All 280 unordered pairs have no declared normalized write/read/write or resource overlap.",
      "evidence": [
        ".ai/plans/current/PLAN-001/reviews/r4-isolation-review.md",
        ".ai/plans/current/PLAN-001/reviews/r4-isolation-reproduction.txt"
      ]
    },
    {
      "id": "ISO-05",
      "status": "pass",
      "rationale": "Common values, local/workflow/orchestration ports, validation and installed dependency closure have sequenced owners.",
      "evidence": [
        ".ai/plans/current/PLAN-001/reviews/r4-isolation-review.md",
        ".ai/plans/current/PLAN-001/reviews/r4-isolation-reproduction.txt"
      ]
    },
    {
      "id": "ISO-06",
      "status": "pass",
      "rationale": "Existing frozen schemas can represent logical-reference strings; no unordered shared schema or fixture writer.",
      "evidence": [
        ".ai/plans/current/PLAN-001/reviews/r4-isolation-review.md",
        ".ai/plans/current/PLAN-001/reviews/r4-isolation-reproduction.txt"
      ]
    },
    {
      "id": "ISO-07",
      "status": "pass",
      "rationale": "TASK-004 owns installed helper closure, TASK-034 wiring, TASK-037 build packaging; injected completion avoids cycles.",
      "evidence": [
        ".ai/plans/current/PLAN-001/reviews/r4-isolation-review.md",
        ".ai/plans/current/PLAN-001/reviews/r4-isolation-reproduction.txt"
      ]
    },
    {
      "id": "ISO-08",
      "status": "pass",
      "rationale": "All 39 graph nodes and task dependencies agree and are acyclic.",
      "evidence": [
        ".ai/plans/current/PLAN-001/reviews/r4-isolation-review.md",
        ".ai/plans/current/PLAN-001/reviews/r4-isolation-reproduction.txt"
      ]
    },
    {
      "id": "ISO-09",
      "status": "pass",
      "rationale": "New installer ownership is safely sequenced with TASK-005/031/037; other surfaces remain isolated.",
      "evidence": [
        ".ai/plans/current/PLAN-001/reviews/r4-isolation-review.md",
        ".ai/plans/current/PLAN-001/reviews/r4-isolation-reproduction.txt"
      ]
    },
    {
      "id": "ISO-10",
      "status": "pass",
      "rationale": "Current component tasks remain useful independent acceptance and review boundaries.",
      "evidence": [
        ".ai/plans/current/PLAN-001/reviews/r4-isolation-review.md",
        ".ai/plans/current/PLAN-001/reviews/r4-isolation-reproduction.txt"
      ]
    },
    {
      "id": "ISO-11",
      "status": "pass",
      "rationale": "Shared values, ports, settings, validation/digest and installed import closure are prerequisite-owned.",
      "evidence": [
        ".ai/plans/current/PLAN-001/reviews/r4-isolation-review.md",
        ".ai/plans/current/PLAN-001/reviews/r4-isolation-reproduction.txt"
      ]
    },
    {
      "id": "ISO-12",
      "status": "pass",
      "rationale": "All nine plan acceptance criteria map to implementation plus combined workflow or installed-package verification.",
      "evidence": [
        ".ai/plans/current/PLAN-001/reviews/r4-isolation-review.md",
        ".ai/plans/current/PLAN-001/reviews/r4-isolation-reproduction.txt"
      ]
    }
  ],
  "findings": [
    {
      "id": "R3-ISO-001",
      "severity": "blocking",
      "category": "structural",
      "description": "Resolved in r4: TASK-004 introduces validator helper dependencies before any owner may update the static standalone installed helper catalog; TASK-034 later repeats this risk for ai.py.",
      "paths": [
        "src/install.py",
        "src/validate_foundation.py",
        ".ai/plans/current/PLAN-001/tasks/current/TASK-004.json",
        ".ai/plans/current/PLAN-001/tasks/current/TASK-034.json"
      ],
      "expected_fix": "Implemented in TASK-004 scope, acceptance and output contracts; verify behavior when that task is implemented.",
      "acceptance_ids": [
        "AC-01",
        "AC-08",
        "AC-09"
      ],
      "resolved": true
    },
    {
      "id": "R3-ISO-002",
      "severity": "major",
      "category": "structural",
      "description": "Resolved in r4: The new lifecycle-neutral digest must define compatibility with reviewed current task identities while old ai.structural_task_digest consumers remain.",
      "paths": [
        ".ai/plans/current/PLAN-001/tasks/current/TASK-004.json",
        "src/ai.py"
      ],
      "expected_fix": "Implemented in TASK-004 scope, acceptance and output contracts; verify behavior when that task is implemented.",
      "acceptance_ids": [
        "AC-01",
        "AC-03",
        "AC-07"
      ],
      "resolved": true
    }
  ],
  "rewrite_summary": [],
  "report_ref": ".ai/plans/current/PLAN-001/reviews/r4-isolation-review.md",
  "created_at": "2026-09-08T01:06:40.651745Z"
}
