{
  "schema_version": "1.0",
  "kind": "isolation-review",
  "id": "ISO-PLAN-001-r2",
  "plan_id": "PLAN-001",
  "graph_revision": 2,
  "task_set_sha256": "1d3085b18c29bb9894d59fea9ee83e2af94feaa02111af6b5c4e7697108a58a8",
  "verdict": "pass",
  "reviewer": "independent Task Isolation Reviewer /root/isolation_review",
  "review_kind": "foundation_design_review",
  "checks": [
    {
      "id": "ISO-01",
      "status": "pass",
      "rationale": "39 bounded slices with two acceptance checks each",
      "evidence": [
        "docs/plans/PLAN-001-isolation-review.md",
        ".ai/graphs/PLAN-001-r2.json"
      ]
    },
    {
      "id": "ISO-02",
      "status": "pass",
      "rationale": "Explicit objectives, scope, verification and handoffs",
      "evidence": [
        "docs/plans/PLAN-001-isolation-review.md",
        ".ai/graphs/PLAN-001-r2.json"
      ]
    },
    {
      "id": "ISO-03",
      "status": "pass",
      "rationale": "Exclusive component/test/documentation ownership",
      "evidence": [
        "docs/plans/PLAN-001-isolation-review.md",
        ".ai/graphs/PLAN-001-r2.json"
      ]
    },
    {
      "id": "ISO-04",
      "status": "pass",
      "rationale": "281 unordered pairs have no declared write/read/resource collision",
      "evidence": [
        "docs/plans/PLAN-001-isolation-review.md",
        ".ai/graphs/PLAN-001-r2.json"
      ]
    },
    {
      "id": "ISO-05",
      "status": "pass",
      "rationale": "Values and three distinct port prerequisites precede consumers",
      "evidence": [
        "docs/plans/PLAN-001-isolation-review.md",
        ".ai/graphs/PLAN-001-r2.json"
      ]
    },
    {
      "id": "ISO-06",
      "status": "pass",
      "rationale": "Foundation schemas frozen; changes require a new owner task",
      "evidence": [
        "docs/plans/PLAN-001-isolation-review.md",
        ".ai/graphs/PLAN-001-r2.json"
      ]
    },
    {
      "id": "ISO-07",
      "status": "pass",
      "rationale": "Configuration, worktree prerequisite, wiring and metadata owners explicit",
      "evidence": [
        "docs/plans/PLAN-001-isolation-review.md",
        ".ai/graphs/PLAN-001-r2.json"
      ]
    },
    {
      "id": "ISO-08",
      "status": "pass",
      "rationale": "39 nodes; exact task/graph parity; no cycles",
      "evidence": [
        "docs/plans/PLAN-001-isolation-review.md",
        ".ai/graphs/PLAN-001-r2.json"
      ]
    },
    {
      "id": "ISO-09",
      "status": "pass",
      "rationale": "Injected execution-to-delivery continuation prevents reverse dependency",
      "evidence": [
        "docs/plans/PLAN-001-isolation-review.md",
        ".ai/graphs/PLAN-001-r2.json"
      ]
    },
    {
      "id": "ISO-10",
      "status": "pass",
      "rationale": "Configuration and orchestration contracts extracted as prerequisites",
      "evidence": [
        "docs/plans/PLAN-001-isolation-review.md",
        ".ai/graphs/PLAN-001-r2.json"
      ]
    },
    {
      "id": "ISO-11",
      "status": "pass",
      "rationale": "Shared groundwork has dedicated prerequisite ownership",
      "evidence": [
        "docs/plans/PLAN-001-isolation-review.md",
        ".ai/graphs/PLAN-001-r2.json"
      ]
    },
    {
      "id": "ISO-12",
      "status": "pass",
      "rationale": "All nine plan criteria covered by task and integrated assertions",
      "evidence": [
        "docs/plans/PLAN-001-isolation-review.md",
        ".ai/graphs/PLAN-001-r2.json"
      ]
    }
  ],
  "findings": [
    {
      "id": "IR-01",
      "severity": "major",
      "category": "structural",
      "description": "Narrow concurrent read scopes",
      "paths": [
        "docs/plans/PLAN-001.md"
      ],
      "expected_fix": "See final review disposition; correction verified in graph revision 2",
      "acceptance_ids": [],
      "resolved": true
    },
    {
      "id": "IR-02",
      "severity": "major",
      "category": "structural",
      "description": "Clarify common values and port ownership",
      "paths": [
        "docs/plans/PLAN-001.md"
      ],
      "expected_fix": "See final review disposition; correction verified in graph revision 2",
      "acceptance_ids": [],
      "resolved": true
    },
    {
      "id": "IR-03",
      "severity": "major",
      "category": "structural",
      "description": "Add upgrade worktree prerequisite",
      "paths": [
        "docs/plans/PLAN-001.md"
      ],
      "expected_fix": "See final review disposition; correction verified in graph revision 2",
      "acceptance_ids": [],
      "resolved": true
    },
    {
      "id": "IR-04",
      "severity": "major",
      "category": "structural",
      "description": "Inject execution-to-delivery continuation",
      "paths": [
        "docs/plans/PLAN-001.md"
      ],
      "expected_fix": "See final review disposition; correction verified in graph revision 2",
      "acceptance_ids": [],
      "resolved": true
    },
    {
      "id": "IR-05",
      "severity": "major",
      "category": "structural",
      "description": "Assign configuration ownership",
      "paths": [
        "docs/plans/PLAN-001.md"
      ],
      "expected_fix": "See final review disposition; correction verified in graph revision 2",
      "acceptance_ids": [],
      "resolved": true
    },
    {
      "id": "IR-06",
      "severity": "major",
      "category": "structural",
      "description": "Map integrated acceptance coverage",
      "paths": [
        "docs/plans/PLAN-001.md"
      ],
      "expected_fix": "See final review disposition; correction verified in graph revision 2",
      "acceptance_ids": [],
      "resolved": true
    },
    {
      "id": "IR-07",
      "severity": "major",
      "category": "structural",
      "description": "Freeze cross-component service contracts",
      "paths": [
        "docs/plans/PLAN-001.md"
      ],
      "expected_fix": "See final review disposition; correction verified in graph revision 2",
      "acceptance_ids": [],
      "resolved": true
    }
  ],
  "rewrite_summary": [
    "Added TASK-038 configuration and TASK-039 orchestration contracts",
    "Corrected dependency/read scopes and coverage; preserved draft graph r1 and snapshot"
  ],
  "report_ref": "docs/plans/PLAN-001-isolation-review.md",
  "created_at": "2026-09-05T18:45:28.578231+00:00"
}
